<?xml version="1.0" encoding="UTF-8" ?>
<pedidoDeCompra xsi:noNamespaceSchemaLocation="pedidoDeCompra.xsd" xmlns:xsi="http://www.w3.org/2001/XMLSchema-instance">
    <header>
        <identificador>1</identificador>
        <codigoLojaParceira>10</codigoLojaParceira>
        <codigoDoCliente>1020</codigoDoCliente>
    </header>
    <body>
     <pedidos>
         <produto>
             <codigo>05545215</codigo>
             <nome>COCA COLA</nome>
             <valor>5.20</valor>
             <quantidade>2</quantidade>
         </produto>
         <produto>
             <codigo>2323</codigo>
             <nome>PIZZA DO DIA</nome>
             <valor>25.90</valor>
             <quantidade>2</quantidade>
         </produto>
         <produto>
             <codigo>9999</codigo>
             <nome>COMBO KIDS</nome>
             <valor>22.90</valor>
             <quantidade>1</quantidade>
         </produto>
     </pedidos>
     <dadosDoCliente>
         <nome>MAXWELL</nome>
         <endereco>Rua B</endereco>
         <numero>12</numero>
         <bairro>CENTRO</bairro>
     </dadosDoCliente>
    </body>
</pedidoDeCompra>
